{
  "format": "btp-presentation-v1",
  "schema_version": 1,
  "palette": [
    "0b1320",
    "1b2b3d",
    "28574d",
    "3e8265",
    "759662",
    "a9bb70",
    "76533a",
    "d6d4bc",
    "46566b",
    "6f94ad",
    "6abec0",
    "bbdccc",
    "b95958",
    "db9672",
    "edcc75",
    "f4f1de"
  ],
  "font": [
    "00000000000000",
    "04040404040004",
    "0a0a0000000000",
    "0e110102040004",
    "040f140e051e04",
    "0e110102040004",
    "0e110102040004",
    "04040800000000",
    "02040808080402",
    "08040202020408",
    "0e110102040004",
    "0e110102040004",
    "00000000000408",
    "0000001f000000",
    "00000000000404",
    "01020204080810",
    "0e11131519110e",
    "040c040404040e",
    "0e11010204081f",
    "1e01010e01011e",
    "02060a121f0202",
    "1f10101e01011e",
    "0e10101e11110e",
    "1f010204080808",
    "0e11110e11110e",
    "0e11110f01010e",
    "00040400040400",
    "00040000040408",
    "0e110102040004",
    "0e110102040004",
    "0e110102040004",
    "0e110102040004",
    "0e110102040004",
    "0e11111f111111",
    "1e11111e11111e",
    "0e11101010110e",
    "1e11111111111e",
    "1f10101e10101f",
    "1f10101e101010",
    "0e11101711110f",
    "1111111f111111",
    "0e04040404040e",
    "0702020202120c",
    "11121418141211",
    "1010101010101f",
    "111b1515111111",
    "11191513111111",
    "0e11111111110e",
    "1e11111e101010",
    "0e11111115120d",
    "1e11111e141211",
    "0f10100e01011e",
    "1f040404040404",
    "1111111111110e",
    "11111111110a04",
    "1111111515150a",
    "11110a040a1111",
    "11110a04040404",
    "1f01020408101f",
    "0e110102040004",
    "0e110102040004",
    "0e110102040004",
    "0e110102040004",
    "0e110102040004",
    "0e110102040004",
    "00000e010f110f",
    "10101e1111111e",
    "00000e1010110e",
    "01010f1111110f",
    "00000e111f100e",
    "06081c08080808",
    "00000f110f010e",
    "10101e11111111",
    "04000c0404040e",
    "0200060202120c",
    "10101214181412",
    "0c04040404040e",
    "00001a15151515",
    "00001e11111111",
    "00000e1111110e",
    "00001e111e1010",
    "00000f110f0101",
    "00001619101010",
    "00000f100e011e",
    "08081c08080906",
    "0000111111130d",
    "00001111110a04",
    "0000111115150a",
    "0000110a040a11",
    "000011110f010e",
    "00001f0204081f",
    "0e110102040004",
    "0e110102040004",
    "0e110102040004",
    "0e110102040004",
    "0e110102040004"
  ],
  "tiles": [
    [
      "2222222222222222",
      "2222222222222222",
      "2222222222222222",
      "2244222222222222",
      "2222222222222222",
      "2222222222244222",
      "2222222222222222",
      "2222222222222222",
      "2222222222222222",
      "2222222222222222",
      "2222222222222222",
      "2222222222222222",
      "2222222442222222",
      "2222222222222222",
      "2222222222222244",
      "2222222222222222"
    ],
    [
      "6666666666666666",
      "6666666666666666",
      "6666666666666666",
      "7777666666666666",
      "6666666666666666",
      "6666666666666666",
      "6666666666666666",
      "6666666666666666",
      "6666666666666666",
      "6666666666666666",
      "6666666666666666",
      "6666667777666666",
      "6666666666666666",
      "6666666666666666",
      "6666666666666666",
      "6666666666666666"
    ],
    [
      "1111111111111111",
      "1111111111111111",
      "1111111111111111",
      "1111119999991111",
      "1111111111111111",
      "1111111111111111",
      "1111111111111111",
      "1111111111111111",
      "1111111111111111",
      "1111999999111111",
      "1111111111111111",
      "1111111111111111",
      "1111111111111111",
      "1111111111111111",
      "9999991111111111",
      "1111111111111111"
    ],
    [
      "2222222222222222",
      "2222244444422222",
      "2222244444422222",
      "2223344444433222",
      "2223344444433222",
      "2223355444433222",
      "2223355444433222",
      "2223344444433222",
      "2223344444433222",
      "2223333333333222",
      "2223333333333222",
      "2223333333333222",
      "2222222666222222",
      "2222222666222222",
      "2222222666222222",
      "2222222666222222"
    ],
    [
      "1111111111111111",
      "8899988888188888",
      "8818888888188888",
      "8818888888188888",
      "1111111111111111",
      "8888188888881888",
      "8888188888881888",
      "8888188888881888",
      "1111111111111111",
      "1888888818888888",
      "1888888818888888",
      "1888888818888888",
      "1111111111111111",
      "8818888888188888",
      "8818888888188888",
      "8818888888188888"
    ],
    [
      "6666666666666666",
      "6611111111111166",
      "6611111111111166",
      "6611999999991166",
      "66119aaaaaa91166",
      "66119aaaaaa91166",
      "66119aaaaaa91166",
      "6611999999991166",
      "6611999999991166",
      "6611999999991166",
      "6611999999e91166",
      "6611999999e91166",
      "6611999999991166",
      "6611999999991166",
      "6611999999991166",
      "6611999999991166"
    ],
    [
      "8888888778888888",
      "8888aaaaaaaa8888",
      "8888aaffffaa8888",
      "8888aaaaaaaa8888",
      "8888888778888888",
      "8888888778888888",
      "8888888778888888",
      "8888999779998888",
      "8888999779998888",
      "8811999779991188",
      "8811999779991188",
      "8811999779991188",
      "8811999999991188",
      "8811111111111188",
      "8811111111111188",
      "8888888888888888"
    ],
    [
      "2222222222222222",
      "2222222222222222",
      "2222222222222222",
      "2222222219999112",
      "2222222219999112",
      "2222222219999112",
      "2222222211111112",
      "2222222211111112",
      "2222222211111112",
      "2288888811111112",
      "2288888811111112",
      "2288888811111112",
      "2288888811111112",
      "2288888822222222",
      "2222222222222222",
      "2222222222222222"
    ]
  ],
  "sprites": [
    [
      [
        "0000000000000000",
        "0000009999000000",
        "0000009ff9000000",
        "0001119999111000",
        "0001aa9999aa1000",
        "0888aaaaaaaa8880",
        "0888aaaaaaaa8880",
        "0888aaaaaaaa8880",
        "0888aaaaaaaa8880",
        "0888111111118880",
        "0007770000777000",
        "0007770000777000",
        "0007770000777000",
        "0007770000777000",
        "0011110000111100",
        "0011110000111100"
      ],
      [
        "0000000000000000",
        "0000009999000000",
        "0000009ff9000000",
        "0001119999111000",
        "0001aa9999aa1000",
        "0888aaaaaaaa8880",
        "0888aaaaaaaa8880",
        "0888aaaaaaaa8880",
        "0888aaaaaaaa8880",
        "0888111111118880",
        "0000777007770000",
        "0000777007770000",
        "0000777007770000",
        "0000777007770000",
        "0001111001111000",
        "0001111001111000"
      ],
      [
        "0000000000000000",
        "0000009999000000",
        "0000009ff9000000",
        "0001119999111000",
        "0001aa9999aa1000",
        "0888aaaaaaaa8880",
        "0888aaaaaaaa8880",
        "0888aaaaaaaa8880",
        "0888aaaaaaaa8880",
        "0888111111118880",
        "0000077777700000",
        "0000077777700000",
        "0000077777700000",
        "0000077777700000",
        "0000111111110000",
        "0000111111110000"
      ],
      [
        "0000000000000000",
        "0000009999000000",
        "0000009ff9000000",
        "0001119999111000",
        "0001aa9999aa1000",
        "0888aaaaaaaa8880",
        "0888aaaaaaaa8880",
        "0888aaaaaaaa8880",
        "0888aaaaaaaa8880",
        "0888111111118880",
        "0007770000777000",
        "0007770000777000",
        "0007770000777000",
        "0007770000777000",
        "0011110000111100",
        "0011110000111100"
      ]
    ],
    [
      [
        "0000000000000000",
        "0000009999000000",
        "0000009ff9000000",
        "0001119999111000",
        "0001dd9999dd1000",
        "0888dddddddd8880",
        "0888dddddddd8880",
        "0888dddddddd8880",
        "0888dddddddd8880",
        "0888111111118880",
        "0007770000777000",
        "0007770000777000",
        "0007770000777000",
        "0007770000777000",
        "0011110000111100",
        "0011110000111100"
      ],
      [
        "0000000000000000",
        "0000009999000000",
        "0000009ff9000000",
        "0001119999111000",
        "0001dd9999dd1000",
        "0888dddddddd8880",
        "0888dddddddd8880",
        "0888dddddddd8880",
        "0888dddddddd8880",
        "0888111111118880",
        "0000777007770000",
        "0000777007770000",
        "0000777007770000",
        "0000777007770000",
        "0001111001111000",
        "0001111001111000"
      ],
      [
        "0000000000000000",
        "0000009999000000",
        "0000009ff9000000",
        "0001119999111000",
        "0001dd9999dd1000",
        "0888dddddddd8880",
        "0888dddddddd8880",
        "0888dddddddd8880",
        "0888dddddddd8880",
        "0888111111118880",
        "0000077777700000",
        "0000077777700000",
        "0000077777700000",
        "0000077777700000",
        "0000111111110000",
        "0000111111110000"
      ],
      [
        "0000000000000000",
        "0000009999000000",
        "0000009ff9000000",
        "0001119999111000",
        "0001dd9999dd1000",
        "0888dddddddd8880",
        "0888dddddddd8880",
        "0888dddddddd8880",
        "0888dddddddd8880",
        "0888111111118880",
        "0007770000777000",
        "0007770000777000",
        "0007770000777000",
        "0007770000777000",
        "0011110000111100",
        "0011110000111100"
      ]
    ],
    [
      [
        "0000000000000000",
        "000000ddddd00000",
        "000000ddddd00000",
        "000000ddddd00000",
        "000000ddddd00000",
        "000077aaaaaa0000",
        "000077aaaaaa0000",
        "000077aaaaa77000",
        "000077aaaaa77000",
        "000077aaaaa77000",
        "00000aaaaaa77000",
        "0000009909977000",